anime_id,name,episodes,aired,image_url,genres,type
124,新機動戦記ガンダムW,49,"Apr 7, 1995 to Mar 29, 1996",https://cdn.myanimelist.net/images/anime/1884/114414.jpg,"Action, Military, Sci-Fi, Space, Drama, Mecha",TV
1683,とある科学の超電磁砲[レールガン]T,25,"Jan 10, 2020 to Sep 25, 2020",https://cdn.myanimelist.net/images/anime/1819/103287.jpg,"Action, Sci-Fi, Super Power",TV
688,テニスの王子様,178,"Oct 10, 2001 to Mar 23, 2005",https://cdn.myanimelist.net/images/anime/6/21624.jpg,"Action, Comedy, Sports, School, Shounen",TV
430,スペース☆ダンディ,13,"Jan 5, 2014 to Mar 27, 2014",https://cdn.myanimelist.net/images/anime/4/56611.jpg,"Sci-Fi, Space, Comedy",TV
190,-クラナド-　もうひとつの世界　智代編,1,"Jul 16, 2008",https://cdn.myanimelist.net/images/anime/12/19620.jpg,"Drama, Romance, School, Slice of Life",Special
1133,神様はじめました,13,"Oct 2, 2012 to Dec 25, 2012",https://cdn.myanimelist.net/images/anime/3/85429.jpg,"Comedy, Demons, Supernatural, Romance, Fantasy, Shoujo",TV
1867,となりの吸血鬼さん,12,"Oct 5, 2018 to Dec 21, 2018",https://cdn.myanimelist.net/images/anime/1851/96154.jpg,"Comedy, Shoujo Ai, Slice of Life, Supernatural, Vampire",TV
1830,ウマ娘 プリティーダービー,13,"Apr 2, 2018 to Jun 18, 2018",https://cdn.myanimelist.net/images/anime/1683/91888.jpg,"Comedy, Slice of Life, Sports",TV
533,グラビテーション,13,"Oct 4, 2000 to Jan 10, 2001",https://cdn.myanimelist.net/images/anime/4/21856.jpg,"Comedy, Music, Romance, Shoujo, Shounen Ai",TV
43,ONE PIECE,1,"Mar 4, 2000",https://cdn.myanimelist.net/images/anime/1770/97704.jpg,"Action, Adventure, Comedy, Super Power, Fantasy, Shounen",Movie
289,PERSONA3 THE MOVIE —#1 Spring of Birth—,1,"Nov 23, 2013",https://cdn.myanimelist.net/images/anime/6/55287.jpg,"Action, Supernatural, Fantasy",Movie
259,黒執事,24,"Oct 3, 2008 to Mar 27, 2009",https://cdn.myanimelist.net/images/anime/5/27013.jpg,"Action, Mystery, Comedy, Historical, Demons, Supernatural, Shounen",TV
258,紅,12,"Apr 4, 2008 to Jun 20, 2008",https://cdn.myanimelist.net/images/anime/2/8482.jpg,"Comedy, Drama, Martial Arts",TV
1130,響け！ユーフォニアム,13,"Apr 8, 2015 to Jul 1, 2015",https://cdn.myanimelist.net/images/anime/6/72445.jpg,"Music, School, Drama",TV
192,ディー・グレイマン,103,"Oct 3, 2006 to Sep 30, 2008",https://cdn.myanimelist.net/images/anime/13/75194.jpg,"Action, Adventure, Comedy, Super Power, Demons, Shounen",TV
1256,TARI TARI,13,"Jul 1, 2012 to Sep 23, 2012",https://cdn.myanimelist.net/images/anime/10/83575.jpg,"Music, Slice of Life, School",TV
1260,トップをねらえ！ GunBuster,6,"Oct 7, 1988 to Jul 7, 1989",https://cdn.myanimelist.net/images/anime/1303/92309.jpg,"Action, Comedy, Drama, Mecha, Military, Sci-Fi, Shounen, Space",OVA
859,Fate/Grand Order -First Order-,1,"Dec 31, 2016",https://cdn.myanimelist.net/images/anime/6/82651.jpg,"Action, Supernatural, Magic, Fantasy",Special
874,はじめの一歩 -Champion Road-,1,"Apr 18, 2003",https://cdn.myanimelist.net/images/anime/9/2361.jpg,"Comedy, Shounen, Sports",Special
1174,純情ロマンチカ 3,12,"Jul 9, 2015 to Sep 24, 2015",https://cdn.myanimelist.net/images/anime/2/74170.jpg,"Comedy, Drama, Romance, Shounen Ai",TV
383,とらドラ！,25,"Oct 2, 2008 to Mar 26, 2009",https://cdn.myanimelist.net/images/anime/13/22128.jpg,"Slice of Life, Comedy, Romance, School",TV
635,私がモテないのはどう考えてもお前らが悪い!,12,"Jul 9, 2013 to Sep 24, 2013",https://cdn.myanimelist.net/images/anime/12/51619.jpg,"Slice of Life, Comedy, School",TV
1456,とある科学の超電磁砲S,24,"Apr 12, 2013 to Sep 27, 2013",https://cdn.myanimelist.net/images/anime/7/75610.jpg,"Action, Sci-Fi, Super Power",TV
1122,DAYS,24,"Jul 2, 2016 to Dec 18, 2016",https://cdn.myanimelist.net/images/anime/11/88507.jpg,"Sports, School, Shounen",TV
358,デジモンアドベンチャー 劇場版,1,"Mar 6, 1999",https://cdn.myanimelist.net/images/anime/3/72452.jpg,"Action, Fantasy, Kids, Sci-Fi",Movie
1596,牙狼〈GARO〉-炎の刻印-,24,"Oct 4, 2014 to Mar 28, 2015",https://cdn.myanimelist.net/images/anime/5/63667.jpg,"Action, Demons, Fantasy, Magic, Supernatural",TV
788,デート・ア・ライブ,12,"Apr 6, 2013 to Jun 22, 2013",https://cdn.myanimelist.net/images/anime/13/44844.jpg,"Sci-Fi, Harem, Comedy, Romance, Mecha, School",TV
519,耳をすませば,1,"Jul 15, 1995",https://cdn.myanimelist.net/images/anime/1899/109259.jpg,"Slice of Life, Drama, Romance, Shoujo",Movie
1886,劇場版 暗殺教室 365日の時間,1,"Nov 19, 2016",https://cdn.myanimelist.net/images/anime/4/84834.jpg,"Action, Comedy, School, Shounen",Movie
201,ヱヴァンゲリヲン新劇場版:破,1,"Jul 27, 2009",https://cdn.myanimelist.net/images/anime/5/74983.jpg,"Action, Sci-Fi, Psychological, Drama, Mecha",Movie
939,涼宮ハルヒちゃんの憂鬱,25,"Feb 14, 2009 to May 8, 2009",https://cdn.myanimelist.net/images/anime/1786/112350.jpg,"Comedy, Parody",ONA
248,刀語,12,"Jan 26, 2010 to Dec 11, 2010",https://cdn.myanimelist.net/images/anime/1112/119225.jpg,"Action, Adventure, Historical, Martial Arts, Romance",TV
1005,ハイキュー!!,25,"Apr 6, 2014 to Sep 21, 2014",https://cdn.myanimelist.net/images/anime/7/76014.jpg,"Comedy, Sports, Drama, School, Shounen",TV
737,荒川アンダー ザブリッジ×ブリッジ,13,"Oct 4, 2010 to Dec 27, 2010",https://cdn.myanimelist.net/images/anime/1851/98621.jpg,"Comedy, Romance, Seinen",TV
1485,生徒会役員共＊ OAD,10,"May 16, 2014 to Sep 17, 2020",https://cdn.myanimelist.net/images/anime/5/79008.jpg,"Slice of Life, Comedy, School, Shounen",OVA
1126,ゴールデンタイム,24,"Oct 4, 2013 to Mar 28, 2014",https://cdn.myanimelist.net/images/anime/12/52091.jpg,"Comedy, Drama, Romance",TV
1011,機動戦士ガンダム 鉄血のオルフェンズ,25,"Oct 4, 2015 to Mar 27, 2016",https://cdn.myanimelist.net/images/anime/6/75879.jpg,"Action, Drama, Mecha, Sci-Fi, Space",TV
1601,AKIBA'S TRIP THE ANIMATION,13,"Jan 4, 2017 to Mar 29, 2017",https://cdn.myanimelist.net/images/anime/9/83185.jpg,"Action, Comedy, Supernatural, Ecchi",TV
646,デジモンアドベンチャーtri.（トライ）第２章「決意」,1,"Mar 12, 2016",https://cdn.myanimelist.net/images/anime/2/77425.jpg,"Action, Adventure, Comedy, Drama",Movie
1766,冴えない彼女〈ヒロイン〉の育てかた♭ #0 「恋と純情のサービス回」,1,"Apr 6, 2017",https://cdn.myanimelist.net/images/anime/12/85115.jpg,"Harem, Comedy, Romance, Ecchi, School",Special
1479,マケン姫っ！,12,"Oct 5, 2011 to Dec 21, 2011",https://cdn.myanimelist.net/images/anime/1215/123362.jpg,"Action, Ecchi, Harem, Martial Arts, School, Super Power",TV
328,彼氏彼女の事情,26,"Oct 2, 1998 to Mar 26, 1999",https://cdn.myanimelist.net/images/anime/1222/108880.jpg,"Comedy, Drama, Romance, School, Shoujo, Slice of Life",TV
1311,世紀末オカルト学院,13,"Jul 6, 2010 to Sep 28, 2010",https://cdn.myanimelist.net/images/anime/5/75257.jpg,"Sci-Fi, Mystery, Comedy, Supernatural, School",TV
697,文豪ストレイドッグス,12,"Apr 7, 2016 to Jun 23, 2016",https://cdn.myanimelist.net/images/anime/3/79409.jpg,"Action, Comedy, Mystery, Seinen, Super Power, Supernatural",TV
107,ルパン三世,23,"Oct 24, 1971 to Mar 26, 1972",https://cdn.myanimelist.net/images/anime/10/15625.jpg,"Action, Adventure, Mystery, Comedy, Seinen",TV
915,ワンパンマン OVA「ロード・トゥ・ヒーロー」,1,"Dec 4, 2015",https://cdn.myanimelist.net/images/anime/1802/124744.jpg,"Action, Sci-Fi, Comedy, Parody, Super Power, Supernatural",OVA
837,僕のヒーローアカデミア救え!救助訓練!,1,"Apr 4, 2017",https://cdn.myanimelist.net/images/anime/1812/111684.jpg,"Action, Comedy, School, Shounen, Super Power",OVA
1887,冴えない彼女の育てかた Fine,1,"Oct 26, 2019",https://cdn.myanimelist.net/images/anime/1671/111411.jpg,"Harem, Comedy, Romance, Ecchi, School",Movie
858,Fate/EXTRA Last Encore,10,"Jan 28, 2018 to Apr 1, 2018",https://cdn.myanimelist.net/images/anime/1122/90836.jpg,"Action, Fantasy, Magic",TV
475,ノラガミ ARAGOTO,13,"Oct 3, 2015 to Dec 26, 2015",https://cdn.myanimelist.net/images/anime/1689/94850.jpg,"Action, Adventure, Comedy, Supernatural, Shounen",TV
